job_role,study_guidance,application_process,universities
Software Engineer,"Focus on Data Structures & Algorithms, Object-Oriented Programming, and System Design. Practice coding challenges daily.",Prepare a strong resume highlighting projects. Practice behavioral and technical interview questions. Network on LinkedIn. Apply through company career pages and job boards.,"Stanford, MIT, UC Berkeley, Carnegie Mellon, University of Waterloo"
Data Scientist,"Master Statistics, Python (Pandas, NumPy, Scikit-learn), Machine Learning algorithms, and data visualization tools (Matplotlib, Seaborn). SQL is crucial.",Showcase a portfolio of data science projects. Tailor your resume to job descriptions. Prepare for case studies and statistical/ML concept interviews.,"Stanford, CMU, UC Berkeley, Columbia, Georgia Tech"
Machine Learning Engineer,"Deep dive into Machine Learning (Deep Learning, NLP, Computer Vision), MLOps, Python, and frameworks like TensorFlow/PyTorch. Strong math background is a plus.",Build end-to-end ML projects. Focus on algorithm implementation and deployment. Be ready for deep technical discussions on models and infrastructure.,"Stanford, CMU, MIT, Georgia Tech, University of Washington"
Web Developer,"Learn HTML, CSS, JavaScript for frontend. For backend, choose Python (Django/Flask), Node.js (Express), or Ruby on Rails. Understand databases (SQL/NoSQL).",Create a diverse portfolio of web projects. Understand version control (Git). Be prepared to discuss frameworks and responsive design.,"Any reputable CS program, specialized bootcamps, online courses (Coursera, Udemy)"
Cybersecurity Analyst,"Study network security, ethical hacking, cryptography, and security frameworks (NIST, ISO 27001). Certifications like CompTIA Security+, CEH are valuable.","Highlight certifications and practical experience (e.g., CTF participation). Prepare for scenario-based questions and technical assessments.","Purdue, Carnegie Mellon, Georgia Tech, University of Maryland"
Product Manager,"Develop strong communication, leadership, and analytical skills. Understand market research, product lifecycle, and agile methodologies. Business acumen is key.",Demonstrate problem-solving and strategic thinking. Prepare for product sense and execution interviews. Showcase leadership and collaboration.,"Harvard Business School, Stanford GSB, Wharton, INSEAD"
UX Designer,"Learn user research, wireframing, prototyping (Figma, Sketch, Adobe XD), usability testing, and information architecture. Empathy is vital.","Present a strong portfolio of design projects. Be ready to discuss your design process, user-centered approach, and tools.","Carnegie Mellon, Georgia Tech, University of Washington, Pratt Institute"
